id,title,description,category,price,rating
518,Blue Light Blocking Glasses Plus - Gray,Computer glasses reducing eye strain during long screen sessions.,Health & Wellness,136.89,4.2
519,Children's Illustrated Storybook Lite,Colorful picture book with moral tales for bedtime reading ages 4-8.,Books & Stationery,16.73,4.0
520,Tablet Stand Adjustable Ultra - Black,"Aluminum foldable stand for tablets and e-readers, ideal for desk and kitchen use. Highly rated by customers.",Electronics,265.63,4.4
521,Adjustable Dumbbell Set Plus - Navy,Space-saving adjustable weights from 5 to 52.5 lbs for home strength training.,Sports & Outdoors,365.01,4.4
522,Massage Gun Percussion Classic - Gray,Cordless deep tissue massager with adjustable speeds for muscle soreness relief.,Health & Wellness,113.37,3.1
523,Meditation and Mindfulness Workbook - White,"Guided exercises for stress relief, breathing techniques, and daily calm. Eco-friendly packaging.",Books & Stationery,43.16,3.1
524,Massage Gun Percussion Pro,Cordless deep tissue massager with adjustable speeds for muscle soreness relief.,Health & Wellness,59.7,4.2
525,Coconut Body Lotion Plus,Rich moisturizing lotion with natural coconut extract for soft smooth skin.,Beauty & Personal Care,33.96,4.8
526,Hardcover Notebook A5 Ruled Essential - Navy,200-page journal with thick paper suitable for fountain pens and bullet journaling.,Books & Stationery,21.59,3.9
527,Cotton Crew Neck T-Shirt Pack Deluxe,"Breathable everyday tees in assorted colors, machine washable and durable. Eco-friendly packaging.",Clothing,17.5,3.9
528,Protein Powder Whey Isolate Lite,"Low-carb post-workout supplement with 25g protein per serving, vanilla flavor.",Health & Wellness,175.65,4.7
529,Blue Light Blocking Glasses Plus,Computer glasses reducing eye strain during long screen sessions.,Health & Wellness,95.02,4.6
530,Waterproof Rain Jacket Unisex Deluxe,"Lightweight packable rain shell with hood, ideal for travel and commuting. Free shipping eligible.",Clothing,214.39,3.7
531,Sun Protection UV Shirt Essential,"Long sleeve UPF 50+ shirt for beach, fishing, and outdoor activities.",Clothing,141.06,4.5
532,Bamboo Cutting Board Set Classic,Eco-friendly boards in three sizes with juice grooves for meal prep.,Home & Kitchen,227.26,3.8
533,Calligraphy Pen Set Essential,"Dip pens, ink, and practice sheets for hand lettering beginners.",Books & Stationery,15.52,3.9
534,Wool Blend Sweater - Red,"Classic knit pullover with ribbed cuffs, warm and stylish for fall and winter.",Clothing,230.96,3.7
535,Programmable Coffee Maker Lite - Gray,"12-cup drip coffee machine with timer, reusable filter, and auto shut-off.",Home & Kitchen,341.79,3.6
536,Digital Body Weight Scale Ultra - Black,"Bluetooth smart scale tracking weight, BMI, and body composition trends. Highly rated by customers.",Health & Wellness,154.99,4.3
537,Robot Vacuum Cleaner Ultra,"Smart mapping vacuum with app control, ideal for pet hair on hardwood and carpet. Highly rated by customers.",Home & Kitchen,177.08,3.5
538,Calligraphy Pen Set Ultra,"Dip pens, ink, and practice sheets for hand lettering beginners. Highly rated by customers.",Books & Stationery,15.37,4.3
539,Resistance Bands Set Pro - Gray,Five latex bands with handles and door anchor for full-body home workouts.,Sports & Outdoors,129.65,4.3
540,Hydrating Moisturizer SPF 30 Lite,Daily facial lotion with broad spectrum sun protection and hyaluronic acid.,Beauty & Personal Care,55.46,4.1
541,Remote Control Car Off-Road Essential - Gray,Rechargeable RC truck with shock absorbers for indoor and outdoor play.,Toys & Games,25.1,4.0
542,Wool Blend Sweater Essential,"Classic knit pullover with ribbed cuffs, warm and stylish for fall and winter.",Clothing,215.96,3.9
543,Memory Foam Pillow Queen Deluxe - Gray,Ergonomic cervical support pillow for better sleep and neck alignment.,Home & Kitchen,20.48,3.7
544,Thermal Base Layer Top Essential,"Moisture-wicking base layer for skiing, snowboarding, and winter sports.",Clothing,201.01,4.9
545,Robot Vacuum Cleaner Essential - Gray,"Smart mapping vacuum with app control, ideal for pet hair on hardwood and carpet.",Home & Kitchen,63.79,4.1
546,Massage Gun Percussion Plus - Navy,Cordless deep tissue massager with adjustable speeds for muscle soreness relief.,Health & Wellness,33.64,4.1
547,Art and Craft Supply Box Plus - Navy,"Glitter, glue, scissors, and paper assortment for creative kids projects.",Toys & Games,78.9,3.7
548,Robot Vacuum Cleaner Essential - Gray,"Smart mapping vacuum with app control, ideal for pet hair on hardwood and carpet.",Home & Kitchen,68.96,4.9
549,Coconut Body Lotion,Rich moisturizing lotion with natural coconut extract for soft smooth skin.,Beauty & Personal Care,58.19,3.9
550,Lip Balm SPF 15 Pack Classic,Moisturizing lip protection with vitamin E for daily outdoor use.,Beauty & Personal Care,87.45,4.3
551,Classic Novel Collection Box Set Classic,Timeless literature anthology with embossed hardcover bindings.,Books & Stationery,11.38,4.4
552,Weighted Blanket 15lb Deluxe,Calming blanket for improved sleep quality and reduced anxiety.,Home & Kitchen,107.58,4.3
553,Folding Camping Chair Plus - Gray,"Portable outdoor chair with cup holder, lightweight for beach and tailgating. Best seller in category.",Sports & Outdoors,271.45,3.5
554,Foam Roller Muscle Recovery Pro - White,High-density roller for myofascial release after workouts and physical therapy. Limited time offer.,Health & Wellness,167.68,4.5
555,Outdoor Bubble Machine - Navy,Battery-powered bubble blower for birthday parties and backyard fun.,Toys & Games,39.22,3.9
556,Colored Pencil Art Set 48 Colors Pro - Red,Professional grade pencils with blending tools for drawing and sketching. Limited time offer.,Books & Stationery,25.53,4.6
557,Portable Power Bank 20000mAh Classic,High-capacity external battery with dual USB ports and fast charge support for phones and tablets. Free shipping eligible.,Electronics,591.98,3.9
558,Classic Novel Collection Box Set Pro - Black,Timeless literature anthology with embossed hardcover bindings.,Books & Stationery,44.98,4.2
559,Blue Light Blocking Glasses Essential - Gray,Computer glasses reducing eye strain during long screen sessions. Highly rated by customers.,Health & Wellness,29.8,4.4
560,Posture Corrector Back Brace Plus - Black,Adjustable shoulder support to improve desk posture and reduce slouching. Eco-friendly packaging.,Health & Wellness,194.64,4.8
561,Retinol Night Cream Deluxe - Black,Anti-aging night moisturizer to smooth fine lines and even skin tone.,Beauty & Personal Care,45.36,4.5
562,Cycling Helmet Adult Deluxe - Gray,Ventilated road bike helmet with adjustable fit system and MIPS protection. Free shipping eligible.,Sports & Outdoors,39.49,4.5
563,Thermal Base Layer Top Ultra - White,"Moisture-wicking base layer for skiing, snowboarding, and winter sports. Highly rated by customers.",Clothing,95.74,4.6
564,Denim Jacket Classic Fit Lite,"Timeless denim outerwear with button closure, versatile casual layer.",Clothing,209.21,3.8
565,Yoga Mat Non-Slip 6mm Ultra,"Extra thick exercise mat with carrying strap for yoga, pilates, and floor workouts.",Sports & Outdoors,177.92,4.6
566,Insulated Water Bottle 32oz Ultra,"Double-wall stainless bottle keeps drinks cold 24 hours, hot 12 hours.",Sports & Outdoors,303.8,4.1
567,Women's Fleece Lined Leggings Ultra - White,Thermal leggings with soft fleece interior for cozy winter layering and yoga. Limited time offer.,Clothing,128.43,4.1
568,Desk Organizer Bamboo Classic,"Multi-compartment tray for pens, phones, and office supplies.",Books & Stationery,11.61,4.2
569,Women's Fleece Lined Leggings Classic - Red,Thermal leggings with soft fleece interior for cozy winter layering and yoga.,Clothing,34.77,4.0
570,Tablet Stand Adjustable Ultra,"Aluminum foldable stand for tablets and e-readers, ideal for desk and kitchen use.",Electronics,486.91,3.7
571,Air Fryer 5 Quart Classic,"Digital air fryer for crispy meals with less oil, includes recipe booklet. Limited time offer.",Home & Kitchen,35.48,4.2
572,Foam Roller Muscle Recovery Plus - Navy,High-density roller for myofascial release after workouts and physical therapy. Free shipping eligible.,Health & Wellness,93.59,4.1
573,Wireless Mouse Ergonomic Pro - Navy,Silent click wireless mouse with adjustable DPI and long-range Bluetooth connectivity.,Electronics,45.8,4.1
574,Stainless Steel Cookware Set 10-Piece Classic,Non-stick pots and pans with even heat distribution for everyday cooking. Best seller in category.,Home & Kitchen,290.46,4.2
575,Electric Kettle 1.7L Plus - White,Fast-boil stainless kettle with auto shut-off for tea and instant meals.,Home & Kitchen,66.61,3.2
576,Resistance Bands Set Pro - White,Five latex bands with handles and door anchor for full-body home workouts.,Sports & Outdoors,331.96,4.1
577,Programmable Coffee Maker,"12-cup drip coffee machine with timer, reusable filter, and auto shut-off.",Home & Kitchen,289.16,4.9
578,Glass Food Storage Containers Ultra - Red,"BPA-free meal prep containers with snap-lock lids, microwave safe.",Home & Kitchen,148.57,4.8
579,Air Fryer 5 Quart Classic,"Digital air fryer for crispy meals with less oil, includes recipe booklet.",Home & Kitchen,103.22,4.2
580,Card Game Party Pack Classic,Fast-paced multiplayer card game suitable for ages 10 and up. Free shipping eligible.,Toys & Games,44.79,4.2
581,Colored Pencil Art Set 48 Colors Plus,Professional grade pencils with blending tools for drawing and sketching.,Books & Stationery,24.12,3.0
582,Women's Fleece Lined Leggings Pro,Thermal leggings with soft fleece interior for cozy winter layering and yoga.,Clothing,63.95,3.9
583,Sleeping Bag 3-Season Plus,Compact mummy bag rated to 20°F for backpacking and car camping. Highly rated by customers.,Sports & Outdoors,304.82,4.5
584,Sun Protection UV Shirt Pro,"Long sleeve UPF 50+ shirt for beach, fishing, and outdoor activities. Highly rated by customers.",Clothing,32.38,4.0
585,Classic Novel Collection Box Set Essential - Red,Timeless literature anthology with embossed hardcover bindings. Best seller in category.,Books & Stationery,12.84,4.7
586,Posture Corrector Back Brace Classic,Adjustable shoulder support to improve desk posture and reduce slouching. Highly rated by customers.,Health & Wellness,86.52,4.7
587,Running Shorts Quick Dry Ultra,Lightweight athletic shorts with moisture-wicking fabric and inner liner.,Clothing,44.52,3.9
588,Thermal Base Layer Top Lite,"Moisture-wicking base layer for skiing, snowboarding, and winter sports.",Clothing,118.35,4.3
589,Foam Roller Muscle Recovery Deluxe - Red,High-density roller for myofascial release after workouts and physical therapy.,Health & Wellness,175.64,4.9
590,Sleeping Bag 3-Season Lite - Gray,Compact mummy bag rated to 20°F for backpacking and car camping.,Sports & Outdoors,350.81,3.5
591,Productivity Planner 2026 Deluxe - Black,"Undated daily planner with goal tracking, habit pages, and monthly reviews.",Books & Stationery,14.61,4.0
592,Wool Blend Sweater Lite,"Classic knit pullover with ribbed cuffs, warm and stylish for fall and winter.",Clothing,80.51,3.4
593,Wooden Chess Set Foldable - White,"Handcrafted chess board with storage for pieces, travel friendly.",Toys & Games,49.08,3.8
594,Essential Oil Diffuser Ultrasonic Ultra,Aromatherapy humidifier with LED mood lighting and timer settings. Best seller in category.,Health & Wellness,166.94,5.0
595,HDMI Cable 6ft 4K,High-speed HDMI 2.0 cable supporting 4K at 60Hz for monitors and projectors.,Electronics,38.49,4.0
596,Wireless Mouse Ergonomic - Navy,Silent click wireless mouse with adjustable DPI and long-range Bluetooth connectivity.,Electronics,546.78,3.2
597,Plush Teddy Bear Large Ultra,Soft hypoallergenic stuffed animal gift for toddlers and collectors.,Toys & Games,27.95,3.7
598,Art and Craft Supply Box Plus,"Glitter, glue, scissors, and paper assortment for creative kids projects.",Toys & Games,62.3,3.4
599,Educational Science Experiment Kit Lite - Black,Safe chemistry and physics experiments with illustrated guide for young scientists.,Toys & Games,48.72,4.3
600,Productivity Planner 2026 Pro,"Undated daily planner with goal tracking, habit pages, and monthly reviews.",Books & Stationery,16.56,4.4
601,Camping Tent 4-Person,"Waterproof dome tent with easy setup, ventilation windows, and rainfly for family trips. Free shipping eligible.",Sports & Outdoors,139.29,4.6
602,Desk Organizer Bamboo,"Multi-compartment tray for pens, phones, and office supplies. Highly rated by customers.",Books & Stationery,32.39,4.5
603,Running Shorts Quick Dry - Red,Lightweight athletic shorts with moisture-wicking fabric and inner liner.,Clothing,12.25,3.5
604,Jigsaw Puzzle 1000 Pieces Landscape Essential - Red,Challenging adult puzzle featuring scenic mountain lake photography.,Toys & Games,71.72,4.4
605,Beard Grooming Kit Plus - White,"Trimming oil, balm, and comb set for beard care and styling. Free shipping eligible.",Beauty & Personal Care,21.93,4.1
606,Mechanical Gaming Keyboard RGB Essential - White,"Tactile switches, per-key RGB lighting, and programmable macros for competitive gaming.",Electronics,430.44,4.7
607,Hiking Backpack 40L Pro,Ergonomic trekking pack with hydration sleeve and rain cover for multi-day hikes.,Sports & Outdoors,374.57,4.6
608,Noise Cancelling Earbuds Classic - Black,True wireless earbuds with transparency mode and sweat resistance for workouts.,Electronics,205.22,5.0
609,Adjustable Dumbbell Set Pro - Red,Space-saving adjustable weights from 5 to 52.5 lbs for home strength training. Highly rated by customers.,Sports & Outdoors,94.09,3.7
610,Educational Science Experiment Kit,Safe chemistry and physics experiments with illustrated guide for young scientists. Highly rated by customers.,Toys & Games,24.77,3.7
611,Wireless Mouse Ergonomic Classic,Silent click wireless mouse with adjustable DPI and long-range Bluetooth connectivity. Highly rated by customers.,Electronics,197.97,4.0
612,Portable Power Bank 20000mAh Ultra,High-capacity external battery with dual USB ports and fast charge support for phones and tablets.,Electronics,170.71,4.1
613,Vitamin C Face Serum Deluxe - Gray,Brightening antioxidant serum to reduce dark spots and improve skin radiance.,Beauty & Personal Care,77.68,3.9
614,Plush Teddy Bear Large,Soft hypoallergenic stuffed animal gift for toddlers and collectors. Free shipping eligible.,Toys & Games,34.89,3.8
615,Hardcover Notebook A5 Ruled Pro - White,200-page journal with thick paper suitable for fountain pens and bullet journaling. Limited time offer.,Books & Stationery,19.94,4.3
616,Hydrating Moisturizer SPF 30 Pro,Daily facial lotion with broad spectrum sun protection and hyaluronic acid.,Beauty & Personal Care,57.45,4.0
617,Cycling Helmet Adult Deluxe - Black,Ventilated road bike helmet with adjustable fit system and MIPS protection.,Sports & Outdoors,356.69,3.8
618,Blue Light Blocking Glasses Classic - Black,Computer glasses reducing eye strain during long screen sessions. Eco-friendly packaging.,Health & Wellness,30.67,3.5
619,Yoga Mat Non-Slip 6mm Plus,"Extra thick exercise mat with carrying strap for yoga, pilates, and floor workouts.",Sports & Outdoors,63.71,3.1
620,Glass Food Storage Containers Essential - Red,"BPA-free meal prep containers with snap-lock lids, microwave safe. Limited time offer.",Home & Kitchen,58.37,4.9
621,Wireless Bluetooth Headphones Ultra - Red,"Premium over-ear headphones with active noise cancellation, 30-hour battery life, and deep bass for music lovers.",Electronics,681.78,4.8
622,Bamboo Cutting Board Set Lite,Eco-friendly boards in three sizes with juice grooves for meal prep. Highly rated by customers.,Home & Kitchen,192.13,4.6
623,Resistance Bands Set Pro,Five latex bands with handles and door anchor for full-body home workouts.,Sports & Outdoors,36.74,4.5
624,Card Game Party Pack Ultra - White,Fast-paced multiplayer card game suitable for ages 10 and up.,Toys & Games,32.35,3.9
625,Men's Winter Puffer Jacket Pro - Red,"Insulated warm jacket with water-resistant shell, perfect for cold weather trips and outdoor hiking. Free shipping eligible.",Clothing,148.72,4.5
626,Blue Light Blocking Glasses,Computer glasses reducing eye strain during long screen sessions. Highly rated by customers.,Health & Wellness,43.85,3.6
627,Cycling Helmet Adult Deluxe - Navy,Ventilated road bike helmet with adjustable fit system and MIPS protection. Limited time offer.,Sports & Outdoors,208.98,4.2
628,Vitamin C Face Serum Classic,Brightening antioxidant serum to reduce dark spots and improve skin radiance.,Beauty & Personal Care,40.2,3.8
629,Electric Kettle 1.7L Plus - Gray,Fast-boil stainless kettle with auto shut-off for tea and instant meals.,Home & Kitchen,60.39,4.5
630,Waterproof Rain Jacket Unisex Plus,"Lightweight packable rain shell with hood, ideal for travel and commuting.",Clothing,57.79,5.0
631,Running Shorts Quick Dry Essential - Black,Lightweight athletic shorts with moisture-wicking fabric and inner liner.,Clothing,217.28,3.7
632,Children's Illustrated Storybook Deluxe,Colorful picture book with moral tales for bedtime reading ages 4-8.,Books & Stationery,19.99,3.9
633,Sleeping Bag 3-Season,Compact mummy bag rated to 20°F for backpacking and car camping. Highly rated by customers.,Sports & Outdoors,183.55,4.2
634,Women's Fleece Lined Leggings Lite - Navy,Thermal leggings with soft fleece interior for cozy winter layering and yoga.,Clothing,231.64,3.3
635,Sleeping Bag 3-Season Deluxe - Black,Compact mummy bag rated to 20°F for backpacking and car camping.,Sports & Outdoors,168.38,3.4
636,Hardcover Notebook A5 Ruled Classic - Gray,200-page journal with thick paper suitable for fountain pens and bullet journaling.,Books & Stationery,23.59,5.0
637,Children's Illustrated Storybook Pro - Black,Colorful picture book with moral tales for bedtime reading ages 4-8.,Books & Stationery,24.01,4.4
638,Noise Cancelling Earbuds Lite,True wireless earbuds with transparency mode and sweat resistance for workouts. Limited time offer.,Electronics,505.09,3.9
639,Men's Winter Puffer Jacket Deluxe,"Insulated warm jacket with water-resistant shell, perfect for cold weather trips and outdoor hiking.",Clothing,93.94,4.2
640,Tablet Stand Adjustable Lite - Navy,"Aluminum foldable stand for tablets and e-readers, ideal for desk and kitchen use. Free shipping eligible.",Electronics,98.66,4.0
641,Electric Toothbrush Rechargeable Pro,Sonic brush with multiple modes and two-minute timer for dental health.,Beauty & Personal Care,66.57,4.2
642,Programmable Coffee Maker Ultra - Navy,"12-cup drip coffee machine with timer, reusable filter, and auto shut-off.",Home & Kitchen,89.01,4.0
643,Exfoliating Face Scrub Ultra,Gentle walnut scrub to remove dead skin cells and unclog pores.,Beauty & Personal Care,69.2,4.1
644,Robot Vacuum Cleaner Deluxe,"Smart mapping vacuum with app control, ideal for pet hair on hardwood and carpet. Free shipping eligible.",Home & Kitchen,291.67,4.5
645,Posture Corrector Back Brace Lite - Navy,Adjustable shoulder support to improve desk posture and reduce slouching.,Health & Wellness,123.71,4.5
646,Foam Roller Muscle Recovery Classic,High-density roller for myofascial release after workouts and physical therapy.,Health & Wellness,21.83,4.9
647,Thermal Base Layer Top Ultra,"Moisture-wicking base layer for skiing, snowboarding, and winter sports. Eco-friendly packaging.",Clothing,105.02,4.4
648,Yoga Mat Non-Slip 6mm - Red,"Extra thick exercise mat with carrying strap for yoga, pilates, and floor workouts.",Sports & Outdoors,239.43,4.2
649,Outdoor Bubble Machine Classic,Battery-powered bubble blower for birthday parties and backyard fun.,Toys & Games,12.66,5.0
650,Hydrating Moisturizer SPF 30 Ultra,Daily facial lotion with broad spectrum sun protection and hyaluronic acid.,Beauty & Personal Care,53.58,4.1
651,Massage Gun Percussion Lite,Cordless deep tissue massager with adjustable speeds for muscle soreness relief. Limited time offer.,Health & Wellness,151.03,3.1
652,Noise Cancelling Earbuds Classic - Gray,True wireless earbuds with transparency mode and sweat resistance for workouts. Highly rated by customers.,Electronics,453.83,4.6
653,Cotton Crew Neck T-Shirt Pack Lite - White,"Breathable everyday tees in assorted colors, machine washable and durable.",Clothing,13.3,4.3
654,Noise Cancelling Earbuds Lite - Navy,True wireless earbuds with transparency mode and sweat resistance for workouts.,Electronics,307.35,4.2
655,Memory Foam Pillow Queen Plus,Ergonomic cervical support pillow for better sleep and neck alignment.,Home & Kitchen,141.48,4.6
656,Coconut Body Lotion - White,Rich moisturizing lotion with natural coconut extract for soft smooth skin. Eco-friendly packaging.,Beauty & Personal Care,29.9,4.0
657,Sun Protection UV Shirt Lite - Navy,"Long sleeve UPF 50+ shirt for beach, fishing, and outdoor activities.",Clothing,195.65,3.1
658,Memory Foam Pillow Queen Classic,Ergonomic cervical support pillow for better sleep and neck alignment.,Home & Kitchen,195.58,4.6
659,Herbal Sleep Tea Blend Lite,Caffeine-free chamomile and valerian tea for relaxing bedtime routine.,Health & Wellness,192.19,3.9
660,Electric Toothbrush Rechargeable Lite - White,Sonic brush with multiple modes and two-minute timer for dental health. Limited time offer.,Beauty & Personal Care,23.2,3.7
661,Noise Cancelling Earbuds,True wireless earbuds with transparency mode and sweat resistance for workouts. Highly rated by customers.,Electronics,791.28,3.2
662,Wool Blend Sweater Essential - White,"Classic knit pullover with ribbed cuffs, warm and stylish for fall and winter. Best seller in category.",Clothing,204.2,4.6
663,Blue Light Blocking Glasses Pro,Computer glasses reducing eye strain during long screen sessions.,Health & Wellness,117.54,3.0
664,Stainless Steel Cookware Set 10-Piece Ultra - Navy,Non-stick pots and pans with even heat distribution for everyday cooking. Highly rated by customers.,Home & Kitchen,218.99,4.8
665,Digital Body Weight Scale Essential,"Bluetooth smart scale tracking weight, BMI, and body composition trends.",Health & Wellness,81.19,4.0
666,Memory Foam Pillow Queen Ultra,Ergonomic cervical support pillow for better sleep and neck alignment. Highly rated by customers.,Home & Kitchen,57.19,4.6
667,Memory Foam Pillow Queen - Gray,Ergonomic cervical support pillow for better sleep and neck alignment.,Home & Kitchen,295.28,4.4
668,Essential Oil Diffuser Ultrasonic,Aromatherapy humidifier with LED mood lighting and timer settings.,Health & Wellness,68.81,5.0
669,Posture Corrector Back Brace Lite,Adjustable shoulder support to improve desk posture and reduce slouching. Highly rated by customers.,Health & Wellness,16.48,4.4
670,Electric Toothbrush Rechargeable Pro,Sonic brush with multiple modes and two-minute timer for dental health. Highly rated by customers.,Beauty & Personal Care,45.56,4.8
671,Women's Fleece Lined Leggings Essential,Thermal leggings with soft fleece interior for cozy winter layering and yoga.,Clothing,50.72,3.9
672,Yoga Mat Non-Slip 6mm Pro,"Extra thick exercise mat with carrying strap for yoga, pilates, and floor workouts. Free shipping eligible.",Sports & Outdoors,162.78,3.4
673,Smart Home Security Camera Ultra,"1080p indoor camera with night vision, motion alerts, and two-way audio via mobile app.",Electronics,50.44,4.7
674,Programmable Coffee Maker Ultra,"12-cup drip coffee machine with timer, reusable filter, and auto shut-off.",Home & Kitchen,190.87,3.4
675,Outdoor Bubble Machine Ultra,Battery-powered bubble blower for birthday parties and backyard fun.,Toys & Games,19.63,4.6
676,Yoga Block and Strap Set Lite,Cork blocks and cotton strap to improve flexibility and alignment in poses.,Health & Wellness,76.35,3.7
677,Portable Power Bank 20000mAh Deluxe,High-capacity external battery with dual USB ports and fast charge support for phones and tablets.,Electronics,852.43,4.3
678,Waterproof Rain Jacket Unisex Pro,"Lightweight packable rain shell with hood, ideal for travel and commuting. Highly rated by customers.",Clothing,203.73,5.0
679,HDMI Cable 6ft 4K Pro,High-speed HDMI 2.0 cable supporting 4K at 60Hz for monitors and projectors. Best seller in category.,Electronics,86.37,4.5
680,Mechanical Gaming Keyboard RGB Ultra - Black,"Tactile switches, per-key RGB lighting, and programmable macros for competitive gaming. Best seller in category.",Electronics,785.33,4.1
681,Stainless Steel Cookware Set 10-Piece,Non-stick pots and pans with even heat distribution for everyday cooking.,Home & Kitchen,160.01,4.4
682,Ceramic Nonstick Frying Pan Ultra - Red,Induction-compatible skillet with PFOA-free coating for healthy cooking. Eco-friendly packaging.,Home & Kitchen,29.88,3.9
683,Hiking Backpack 40L Deluxe,Ergonomic trekking pack with hydration sleeve and rain cover for multi-day hikes.,Sports & Outdoors,396.55,5.0
684,Productivity Planner 2026 Classic,"Undated daily planner with goal tracking, habit pages, and monthly reviews.",Books & Stationery,7.58,3.8
685,Colored Pencil Art Set 48 Colors Pro,Professional grade pencils with blending tools for drawing and sketching. Eco-friendly packaging.,Books & Stationery,17.77,4.1
686,Family Board Game Strategy Lite,"Award-winning tabletop game for 2-4 players, 45-minute play time.",Toys & Games,13.11,4.5
687,Cycling Helmet Adult Pro,Ventilated road bike helmet with adjustable fit system and MIPS protection.,Sports & Outdoors,337.4,4.4
688,Productivity Planner 2026 Classic,"Undated daily planner with goal tracking, habit pages, and monthly reviews. Free shipping eligible.",Books & Stationery,38.55,4.4
689,Outdoor Bubble Machine Ultra,Battery-powered bubble blower for birthday parties and backyard fun. Limited time offer.,Toys & Games,46.91,3.9
690,Robot Vacuum Cleaner Classic,"Smart mapping vacuum with app control, ideal for pet hair on hardwood and carpet.",Home & Kitchen,205.83,4.1
