id,title,description,category,price,rating
345,Electric Kettle 1.7L Pro,Fast-boil stainless kettle with auto shut-off for tea and instant meals.,Home & Kitchen,263.71,4.6
346,Memory Foam Pillow Queen Classic - Red,Ergonomic cervical support pillow for better sleep and neck alignment. Limited time offer.,Home & Kitchen,234.29,3.8
347,Retinol Night Cream Pro - White,Anti-aging night moisturizer to smooth fine lines and even skin tone. Highly rated by customers.,Beauty & Personal Care,27.55,4.6
348,Memory Foam Pillow Queen Essential,Ergonomic cervical support pillow for better sleep and neck alignment. Highly rated by customers.,Home & Kitchen,69.45,5.0
349,Camping Tent 4-Person Classic,"Waterproof dome tent with easy setup, ventilation windows, and rainfly for family trips.",Sports & Outdoors,232.8,4.4
350,Beard Grooming Kit Classic - Gray,"Trimming oil, balm, and comb set for beard care and styling.",Beauty & Personal Care,71.49,4.6
351,Women's Fleece Lined Leggings Pro,Thermal leggings with soft fleece interior for cozy winter layering and yoga. Best seller in category.,Clothing,124.87,4.8
352,Wooden Chess Set Foldable Ultra - Gray,"Handcrafted chess board with storage for pieces, travel friendly.",Toys & Games,56.55,4.0
353,Vitamin C Face Serum Pro,Brightening antioxidant serum to reduce dark spots and improve skin radiance. Limited time offer.,Beauty & Personal Care,23.0,4.6
354,Denim Jacket Classic Fit Plus - Black,"Timeless denim outerwear with button closure, versatile casual layer.",Clothing,36.15,4.0
355,Noise Cancelling Earbuds Pro - White,True wireless earbuds with transparency mode and sweat resistance for workouts.,Electronics,859.53,4.4
356,Hydrating Moisturizer SPF 30 Lite,Daily facial lotion with broad spectrum sun protection and hyaluronic acid. Limited time offer.,Beauty & Personal Care,43.07,4.7
357,Men's Winter Puffer Jacket Deluxe,"Insulated warm jacket with water-resistant shell, perfect for cold weather trips and outdoor hiking. Limited time offer.",Clothing,239.47,3.8
358,Denim Jacket Classic Fit Deluxe,"Timeless denim outerwear with button closure, versatile casual layer.",Clothing,21.74,3.0
359,Programmable Coffee Maker Plus,"12-cup drip coffee machine with timer, reusable filter, and auto shut-off. Eco-friendly packaging.",Home & Kitchen,39.69,3.7
360,Argan Oil Hair Treatment,Nourishing leave-in oil to repair dry damaged hair and reduce frizz.,Beauty & Personal Care,49.8,4.8
361,Yoga Block and Strap Set Deluxe - Gray,Cork blocks and cotton strap to improve flexibility and alignment in poses.,Health & Wellness,21.53,3.7
362,Mechanical Gaming Keyboard RGB Classic - Gray,"Tactile switches, per-key RGB lighting, and programmable macros for competitive gaming.",Electronics,354.9,4.7
363,Sleeping Bag 3-Season Classic,Compact mummy bag rated to 20°F for backpacking and car camping. Best seller in category.,Sports & Outdoors,284.61,3.7
364,Sleeping Bag 3-Season Classic,Compact mummy bag rated to 20°F for backpacking and car camping.,Sports & Outdoors,134.49,4.1
365,Classic Novel Collection Box Set Ultra,Timeless literature anthology with embossed hardcover bindings.,Books & Stationery,22.25,4.2
366,Herbal Sleep Tea Blend Plus,Caffeine-free chamomile and valerian tea for relaxing bedtime routine. Limited time offer.,Health & Wellness,32.96,3.7
367,Hardcover Notebook A5 Ruled Plus - Gray,200-page journal with thick paper suitable for fountain pens and bullet journaling.,Books & Stationery,6.05,4.1
368,Vitamin C Face Serum Lite,Brightening antioxidant serum to reduce dark spots and improve skin radiance.,Beauty & Personal Care,47.65,3.4
369,Yoga Mat Non-Slip 6mm Plus,"Extra thick exercise mat with carrying strap for yoga, pilates, and floor workouts.",Sports & Outdoors,183.47,4.0
370,Lip Balm SPF 15 Pack Ultra,Moisturizing lip protection with vitamin E for daily outdoor use. Highly rated by customers.,Beauty & Personal Care,76.14,4.2
371,Hydrating Moisturizer SPF 30 Essential,Daily facial lotion with broad spectrum sun protection and hyaluronic acid.,Beauty & Personal Care,34.12,3.1
372,Educational Science Experiment Kit Classic,Safe chemistry and physics experiments with illustrated guide for young scientists.,Toys & Games,43.11,3.7
373,USB-C Laptop Charger 65W Pro - Gray,"Fast charging adapter compatible with most ultrabooks and tablets, compact travel design.",Electronics,216.78,4.3
374,Camping Tent 4-Person Lite,"Waterproof dome tent with easy setup, ventilation windows, and rainfly for family trips.",Sports & Outdoors,372.62,3.6
375,Jigsaw Puzzle 1000 Pieces Landscape Classic,Challenging adult puzzle featuring scenic mountain lake photography.,Toys & Games,41.79,4.4
376,Waterproof Rain Jacket Unisex Ultra,"Lightweight packable rain shell with hood, ideal for travel and commuting.",Clothing,47.66,4.5
377,Makeup Brush Set 12-Piece Ultra,"Synthetic bristle brushes for foundation, blush, and eye makeup application.",Beauty & Personal Care,19.19,4.3
378,Essential Oil Diffuser Ultrasonic Lite,Aromatherapy humidifier with LED mood lighting and timer settings.,Health & Wellness,13.73,4.6
379,Lip Balm SPF 15 Pack Classic - White,Moisturizing lip protection with vitamin E for daily outdoor use. Eco-friendly packaging.,Beauty & Personal Care,10.53,3.4
380,Posture Corrector Back Brace Pro,Adjustable shoulder support to improve desk posture and reduce slouching.,Health & Wellness,127.97,4.7
381,Beard Grooming Kit Essential - White,"Trimming oil, balm, and comb set for beard care and styling. Highly rated by customers.",Beauty & Personal Care,54.11,3.7
382,Herbal Sleep Tea Blend Ultra,Caffeine-free chamomile and valerian tea for relaxing bedtime routine.,Health & Wellness,170.84,4.2
383,Electric Toothbrush Rechargeable Classic - Black,Sonic brush with multiple modes and two-minute timer for dental health. Eco-friendly packaging.,Beauty & Personal Care,77.12,5.0
384,Thermal Base Layer Top Essential - White,"Moisture-wicking base layer for skiing, snowboarding, and winter sports.",Clothing,50.57,4.0
385,Posture Corrector Back Brace Deluxe - Gray,Adjustable shoulder support to improve desk posture and reduce slouching. Eco-friendly packaging.,Health & Wellness,171.98,4.2
386,Remote Control Car Off-Road Deluxe,Rechargeable RC truck with shock absorbers for indoor and outdoor play.,Toys & Games,73.4,3.7
387,Electric Toothbrush Rechargeable Pro - Gray,Sonic brush with multiple modes and two-minute timer for dental health.,Beauty & Personal Care,56.88,5.0
388,Mechanical Gaming Keyboard RGB Classic,"Tactile switches, per-key RGB lighting, and programmable macros for competitive gaming. Eco-friendly packaging.",Electronics,334.6,3.7
389,Yoga Block and Strap Set Lite - Gray,Cork blocks and cotton strap to improve flexibility and alignment in poses.,Health & Wellness,71.54,4.5
390,Wooden Chess Set Foldable Ultra,"Handcrafted chess board with storage for pieces, travel friendly. Free shipping eligible.",Toys & Games,51.45,4.8
391,Yoga Block and Strap Set Pro,Cork blocks and cotton strap to improve flexibility and alignment in poses.,Health & Wellness,89.42,4.6
392,Meditation and Mindfulness Workbook Plus,"Guided exercises for stress relief, breathing techniques, and daily calm.",Books & Stationery,9.05,4.4
393,Plush Teddy Bear Large Classic - Red,Soft hypoallergenic stuffed animal gift for toddlers and collectors. Highly rated by customers.,Toys & Games,33.91,4.2
394,Card Game Party Pack Lite - Red,Fast-paced multiplayer card game suitable for ages 10 and up.,Toys & Games,21.42,3.6
395,Exfoliating Face Scrub Essential - Navy,Gentle walnut scrub to remove dead skin cells and unclog pores. Limited time offer.,Beauty & Personal Care,65.36,5.0
396,Outdoor Bubble Machine Essential - Red,Battery-powered bubble blower for birthday parties and backyard fun. Limited time offer.,Toys & Games,31.88,4.3
397,Posture Corrector Back Brace Classic,Adjustable shoulder support to improve desk posture and reduce slouching.,Health & Wellness,123.05,4.2
398,Digital Body Weight Scale Deluxe,"Bluetooth smart scale tracking weight, BMI, and body composition trends. Limited time offer.",Health & Wellness,38.88,3.7
399,Folding Camping Chair Lite - Navy,"Portable outdoor chair with cup holder, lightweight for beach and tailgating.",Sports & Outdoors,85.55,4.2
400,Retinol Night Cream Deluxe,Anti-aging night moisturizer to smooth fine lines and even skin tone.,Beauty & Personal Care,88.33,4.2
401,Outdoor Bubble Machine Ultra - Navy,Battery-powered bubble blower for birthday parties and backyard fun. Highly rated by customers.,Toys & Games,11.14,5.0
402,Cycling Helmet Adult,Ventilated road bike helmet with adjustable fit system and MIPS protection. Limited time offer.,Sports & Outdoors,241.58,4.2
403,Classic Novel Collection Box Set Deluxe - Black,Timeless literature anthology with embossed hardcover bindings.,Books & Stationery,40.99,4.2
404,Art and Craft Supply Box Deluxe - Red,"Glitter, glue, scissors, and paper assortment for creative kids projects.",Toys & Games,47.0,3.7
405,Waterproof Rain Jacket Unisex Lite,"Lightweight packable rain shell with hood, ideal for travel and commuting. Eco-friendly packaging.",Clothing,76.75,3.8
406,Weighted Blanket 15lb Lite,Calming blanket for improved sleep quality and reduced anxiety.,Home & Kitchen,214.8,4.5
407,Building Blocks STEM Kit 500pc Pro - Black,Creative construction set encouraging engineering skills for kids ages 6+.,Toys & Games,55.79,3.3
408,Foam Roller Muscle Recovery Plus,High-density roller for myofascial release after workouts and physical therapy. Best seller in category.,Health & Wellness,15.4,4.7
409,Family Board Game Strategy Lite - White,"Award-winning tabletop game for 2-4 players, 45-minute play time.",Toys & Games,25.96,4.7
410,Noise Cancelling Earbuds Pro - Black,True wireless earbuds with transparency mode and sweat resistance for workouts.,Electronics,239.24,3.8
411,Portable Power Bank 20000mAh Plus,High-capacity external battery with dual USB ports and fast charge support for phones and tablets. Free shipping eligible.,Electronics,504.33,4.4
412,Productivity Planner 2026 Classic,"Undated daily planner with goal tracking, habit pages, and monthly reviews. Limited time offer.",Books & Stationery,32.43,4.8
413,Portable Power Bank 20000mAh,High-capacity external battery with dual USB ports and fast charge support for phones and tablets. Limited time offer.,Electronics,516.17,4.1
414,Folding Camping Chair Classic - Gray,"Portable outdoor chair with cup holder, lightweight for beach and tailgating.",Sports & Outdoors,392.72,4.0
415,Thermal Base Layer Top Classic,"Moisture-wicking base layer for skiing, snowboarding, and winter sports. Limited time offer.",Clothing,133.96,4.1
416,Stainless Steel Cookware Set 10-Piece Classic - Red,Non-stick pots and pans with even heat distribution for everyday cooking.,Home & Kitchen,281.49,4.3
417,Argan Oil Hair Treatment Deluxe - Black,Nourishing leave-in oil to repair dry damaged hair and reduce frizz.,Beauty & Personal Care,41.04,3.9
418,Hardcover Notebook A5 Ruled Ultra,200-page journal with thick paper suitable for fountain pens and bullet journaling.,Books & Stationery,40.7,4.0
419,Cotton Crew Neck T-Shirt Pack Plus - Navy,"Breathable everyday tees in assorted colors, machine washable and durable.",Clothing,173.77,4.3
420,Yoga Mat Non-Slip 6mm,"Extra thick exercise mat with carrying strap for yoga, pilates, and floor workouts.",Sports & Outdoors,384.43,4.0
421,Insulated Water Bottle 32oz Essential,"Double-wall stainless bottle keeps drinks cold 24 hours, hot 12 hours. Free shipping eligible.",Sports & Outdoors,95.63,3.6
422,Hiking Backpack 40L Essential,Ergonomic trekking pack with hydration sleeve and rain cover for multi-day hikes. Best seller in category.,Sports & Outdoors,198.05,3.3
423,Trail Running Shoes Plus,Lightweight grippy soles with cushioned midsole for rocky and muddy trails.,Sports & Outdoors,352.9,4.2
424,Trail Running Shoes Pro - White,Lightweight grippy soles with cushioned midsole for rocky and muddy trails.,Sports & Outdoors,215.95,4.8
425,Weighted Blanket 15lb Lite - Navy,Calming blanket for improved sleep quality and reduced anxiety.,Home & Kitchen,260.01,4.4
426,Herbal Sleep Tea Blend Essential,Caffeine-free chamomile and valerian tea for relaxing bedtime routine.,Health & Wellness,118.58,3.6
427,Building Blocks STEM Kit 500pc Lite - Red,Creative construction set encouraging engineering skills for kids ages 6+. Free shipping eligible.,Toys & Games,72.37,3.8
428,Wooden Chess Set Foldable Classic - White,"Handcrafted chess board with storage for pieces, travel friendly.",Toys & Games,65.07,4.0
429,Essential Oil Diffuser Ultrasonic Pro,Aromatherapy humidifier with LED mood lighting and timer settings.,Health & Wellness,50.22,5.0
430,Plush Teddy Bear Large Lite - Black,Soft hypoallergenic stuffed animal gift for toddlers and collectors.,Toys & Games,11.6,5.0
431,Card Game Party Pack Classic,Fast-paced multiplayer card game suitable for ages 10 and up.,Toys & Games,36.02,5.0
432,Protein Powder Whey Isolate Classic,"Low-carb post-workout supplement with 25g protein per serving, vanilla flavor.",Health & Wellness,177.98,4.3
433,Noise Cancelling Earbuds Classic,True wireless earbuds with transparency mode and sweat resistance for workouts.,Electronics,297.11,5.0
434,Essential Oil Diffuser Ultrasonic - Red,Aromatherapy humidifier with LED mood lighting and timer settings. Free shipping eligible.,Health & Wellness,120.65,3.8
435,Productivity Planner 2026 Deluxe - Red,"Undated daily planner with goal tracking, habit pages, and monthly reviews.",Books & Stationery,29.47,4.0
436,HDMI Cable 6ft 4K,High-speed HDMI 2.0 cable supporting 4K at 60Hz for monitors and projectors. Eco-friendly packaging.,Electronics,428.39,4.7
437,Noise Cancelling Earbuds Pro - Navy,True wireless earbuds with transparency mode and sweat resistance for workouts.,Electronics,348.45,4.3
438,Beginner Python Programming Guide Plus - Red,"Hands-on coding book covering fundamentals, data structures, and projects. Best seller in category.",Books & Stationery,11.11,4.4
439,Beard Grooming Kit Ultra,"Trimming oil, balm, and comb set for beard care and styling. Best seller in category.",Beauty & Personal Care,63.45,3.2
440,Exfoliating Face Scrub Pro - Red,Gentle walnut scrub to remove dead skin cells and unclog pores. Highly rated by customers.,Beauty & Personal Care,85.35,3.7
441,Retinol Night Cream Pro,Anti-aging night moisturizer to smooth fine lines and even skin tone.,Beauty & Personal Care,16.01,4.2
442,Wooden Chess Set Foldable Plus - Black,"Handcrafted chess board with storage for pieces, travel friendly. Free shipping eligible.",Toys & Games,70.79,3.9
443,Sleeping Bag 3-Season Classic - Gray,Compact mummy bag rated to 20°F for backpacking and car camping.,Sports & Outdoors,96.59,3.5
444,Exfoliating Face Scrub Lite,Gentle walnut scrub to remove dead skin cells and unclog pores.,Beauty & Personal Care,50.28,3.9
445,Resistance Bands Set Lite - Red,Five latex bands with handles and door anchor for full-body home workouts. Free shipping eligible.,Sports & Outdoors,118.33,4.3
446,Meditation and Mindfulness Workbook,"Guided exercises for stress relief, breathing techniques, and daily calm.",Books & Stationery,24.78,4.6
447,Massage Gun Percussion,Cordless deep tissue massager with adjustable speeds for muscle soreness relief. Free shipping eligible.,Health & Wellness,134.02,3.3
448,Yoga Mat Non-Slip 6mm,"Extra thick exercise mat with carrying strap for yoga, pilates, and floor workouts.",Sports & Outdoors,61.95,4.2
449,Air Fryer 5 Quart,"Digital air fryer for crispy meals with less oil, includes recipe booklet. Highly rated by customers.",Home & Kitchen,115.57,4.1
450,Yoga Block and Strap Set Essential - Red,Cork blocks and cotton strap to improve flexibility and alignment in poses. Highly rated by customers.,Health & Wellness,175.94,4.3
451,Sleeping Bag 3-Season Plus - Gray,Compact mummy bag rated to 20°F for backpacking and car camping.,Sports & Outdoors,393.15,3.6
452,Sleeping Bag 3-Season Deluxe,Compact mummy bag rated to 20°F for backpacking and car camping. Highly rated by customers.,Sports & Outdoors,381.19,3.7
453,Colored Pencil Art Set 48 Colors Classic,Professional grade pencils with blending tools for drawing and sketching.,Books & Stationery,11.37,4.8
454,Exfoliating Face Scrub Essential - Navy,Gentle walnut scrub to remove dead skin cells and unclog pores.,Beauty & Personal Care,52.78,2.9
455,Exfoliating Face Scrub Plus - Navy,Gentle walnut scrub to remove dead skin cells and unclog pores.,Beauty & Personal Care,76.51,3.8
456,Weighted Blanket 15lb Deluxe - Black,Calming blanket for improved sleep quality and reduced anxiety. Free shipping eligible.,Home & Kitchen,197.52,4.0
457,Digital Body Weight Scale Ultra - Gray,"Bluetooth smart scale tracking weight, BMI, and body composition trends.",Health & Wellness,59.36,4.0
458,Lip Balm SPF 15 Pack Lite,Moisturizing lip protection with vitamin E for daily outdoor use.,Beauty & Personal Care,77.01,3.9
459,Men's Winter Puffer Jacket Classic,"Insulated warm jacket with water-resistant shell, perfect for cold weather trips and outdoor hiking.",Clothing,186.23,4.4
460,Ceramic Nonstick Frying Pan,Induction-compatible skillet with PFOA-free coating for healthy cooking. Eco-friendly packaging.,Home & Kitchen,140.88,4.4
461,Wireless Mouse Ergonomic Pro,Silent click wireless mouse with adjustable DPI and long-range Bluetooth connectivity. Eco-friendly packaging.,Electronics,686.85,4.1
462,Air Fryer 5 Quart Classic,"Digital air fryer for crispy meals with less oil, includes recipe booklet. Limited time offer.",Home & Kitchen,86.46,3.9
463,4K Smart LED TV 55 inch Lite - Red,"Ultra HD television with HDR10, built-in streaming apps, and voice control for home entertainment.",Electronics,121.66,4.1
464,Family Board Game Strategy Lite - Red,"Award-winning tabletop game for 2-4 players, 45-minute play time.",Toys & Games,16.93,4.2
465,Camping Tent 4-Person Essential - Navy,"Waterproof dome tent with easy setup, ventilation windows, and rainfly for family trips.",Sports & Outdoors,340.82,3.8
466,Coconut Body Lotion Deluxe,Rich moisturizing lotion with natural coconut extract for soft smooth skin.,Beauty & Personal Care,41.5,4.5
467,Jigsaw Puzzle 1000 Pieces Landscape Classic,Challenging adult puzzle featuring scenic mountain lake photography. Best seller in category.,Toys & Games,26.92,4.7
468,Vitamin C Face Serum Lite,Brightening antioxidant serum to reduce dark spots and improve skin radiance.,Beauty & Personal Care,76.96,4.9
469,Essential Oil Diffuser Ultrasonic Lite,Aromatherapy humidifier with LED mood lighting and timer settings.,Health & Wellness,111.27,4.9
470,Protein Powder Whey Isolate Ultra,"Low-carb post-workout supplement with 25g protein per serving, vanilla flavor.",Health & Wellness,57.78,4.0
471,Glass Food Storage Containers Ultra - Black,"BPA-free meal prep containers with snap-lock lids, microwave safe.",Home & Kitchen,329.15,4.3
472,Argan Oil Hair Treatment Deluxe - Navy,Nourishing leave-in oil to repair dry damaged hair and reduce frizz. Best seller in category.,Beauty & Personal Care,70.97,4.1
473,Desk Organizer Bamboo Plus - White,"Multi-compartment tray for pens, phones, and office supplies.",Books & Stationery,25.13,4.1
474,Outdoor Bubble Machine Classic,Battery-powered bubble blower for birthday parties and backyard fun. Free shipping eligible.,Toys & Games,47.02,4.1
475,Wooden Chess Set Foldable,"Handcrafted chess board with storage for pieces, travel friendly. Free shipping eligible.",Toys & Games,19.09,4.2
476,Wireless Bluetooth Headphones Ultra,"Premium over-ear headphones with active noise cancellation, 30-hour battery life, and deep bass for music lovers. Free shipping eligible.",Electronics,856.79,4.8
477,Merino Wool Hiking Socks,Cushioned wool socks that regulate temperature on long trail hikes.,Clothing,237.91,4.4
478,Noise Cancelling Earbuds Classic,True wireless earbuds with transparency mode and sweat resistance for workouts.,Electronics,505.1,3.6
479,Foam Roller Muscle Recovery Ultra,High-density roller for myofascial release after workouts and physical therapy.,Health & Wellness,59.35,4.7
480,Resistance Bands Set Deluxe,Five latex bands with handles and door anchor for full-body home workouts. Best seller in category.,Sports & Outdoors,65.08,4.3
481,Memory Foam Pillow Queen Pro - Gray,Ergonomic cervical support pillow for better sleep and neck alignment.,Home & Kitchen,124.43,4.4
482,Ceramic Nonstick Frying Pan Deluxe - White,Induction-compatible skillet with PFOA-free coating for healthy cooking. Free shipping eligible.,Home & Kitchen,171.92,4.3
483,Beard Grooming Kit Ultra,"Trimming oil, balm, and comb set for beard care and styling.",Beauty & Personal Care,51.08,4.4
484,Weighted Blanket 15lb Deluxe,Calming blanket for improved sleep quality and reduced anxiety. Free shipping eligible.,Home & Kitchen,345.23,4.4
485,Women's Fleece Lined Leggings Ultra,Thermal leggings with soft fleece interior for cozy winter layering and yoga.,Clothing,187.76,3.3
486,Noise Cancelling Earbuds,True wireless earbuds with transparency mode and sweat resistance for workouts.,Electronics,150.14,4.4
487,Sticky Notes Assorted Pack Essential,Neon and pastel repositionable notes for office and study organization. Free shipping eligible.,Books & Stationery,19.31,3.8
488,Glass Food Storage Containers Lite - Red,"BPA-free meal prep containers with snap-lock lids, microwave safe. Best seller in category.",Home & Kitchen,131.34,4.0
489,Insulated Water Bottle 32oz - Red,"Double-wall stainless bottle keeps drinks cold 24 hours, hot 12 hours. Eco-friendly packaging.",Sports & Outdoors,256.01,4.2
490,Essential Oil Diffuser Ultrasonic,Aromatherapy humidifier with LED mood lighting and timer settings. Free shipping eligible.,Health & Wellness,160.41,5.0
491,Bamboo Cutting Board Set Plus - Red,Eco-friendly boards in three sizes with juice grooves for meal prep. Free shipping eligible.,Home & Kitchen,323.77,3.7
492,Sleeping Bag 3-Season Plus - Gray,Compact mummy bag rated to 20°F for backpacking and car camping. Best seller in category.,Sports & Outdoors,262.19,4.2
493,Outdoor Bubble Machine Essential,Battery-powered bubble blower for birthday parties and backyard fun. Free shipping eligible.,Toys & Games,78.54,4.1
494,Plush Teddy Bear Large Essential,Soft hypoallergenic stuffed animal gift for toddlers and collectors.,Toys & Games,14.28,4.7
495,HDMI Cable 6ft 4K Essential - Gray,High-speed HDMI 2.0 cable supporting 4K at 60Hz for monitors and projectors. Best seller in category.,Electronics,129.06,4.1
496,Hydrating Moisturizer SPF 30 - Navy,Daily facial lotion with broad spectrum sun protection and hyaluronic acid.,Beauty & Personal Care,59.21,4.3
497,Coconut Body Lotion Ultra,Rich moisturizing lotion with natural coconut extract for soft smooth skin. Best seller in category.,Beauty & Personal Care,82.67,3.7
498,Men's Winter Puffer Jacket Deluxe - Red,"Insulated warm jacket with water-resistant shell, perfect for cold weather trips and outdoor hiking.",Clothing,184.1,4.8
499,Insulated Water Bottle 32oz Plus,"Double-wall stainless bottle keeps drinks cold 24 hours, hot 12 hours. Highly rated by customers.",Sports & Outdoors,270.12,3.5
500,Lip Balm SPF 15 Pack Essential,Moisturizing lip protection with vitamin E for daily outdoor use.,Beauty & Personal Care,46.3,4.4
501,Trail Running Shoes Classic,Lightweight grippy soles with cushioned midsole for rocky and muddy trails.,Sports & Outdoors,149.89,4.3
502,Denim Jacket Classic Fit Pro,"Timeless denim outerwear with button closure, versatile casual layer.",Clothing,172.71,4.4
503,Digital Body Weight Scale Ultra,"Bluetooth smart scale tracking weight, BMI, and body composition trends.",Health & Wellness,19.53,3.5
504,Foam Roller Muscle Recovery Pro - White,High-density roller for myofascial release after workouts and physical therapy. Free shipping eligible.,Health & Wellness,178.9,4.0
505,Cycling Helmet Adult Ultra,Ventilated road bike helmet with adjustable fit system and MIPS protection.,Sports & Outdoors,270.14,4.6
506,Digital Body Weight Scale Lite - Black,"Bluetooth smart scale tracking weight, BMI, and body composition trends. Highly rated by customers.",Health & Wellness,189.19,5.0
507,Thermal Base Layer Top Deluxe,"Moisture-wicking base layer for skiing, snowboarding, and winter sports.",Clothing,187.03,4.1
508,Tablet Stand Adjustable Plus,"Aluminum foldable stand for tablets and e-readers, ideal for desk and kitchen use.",Electronics,511.65,4.6
509,Family Board Game Strategy Pro,"Award-winning tabletop game for 2-4 players, 45-minute play time. Best seller in category.",Toys & Games,45.12,4.3
510,Massage Gun Percussion Lite,Cordless deep tissue massager with adjustable speeds for muscle soreness relief.,Health & Wellness,90.41,4.2
511,Wireless Bluetooth Headphones Ultra,"Premium over-ear headphones with active noise cancellation, 30-hour battery life, and deep bass for music lovers. Limited time offer.",Electronics,317.65,4.0
512,Classic Novel Collection Box Set Essential,Timeless literature anthology with embossed hardcover bindings. Eco-friendly packaging.,Books & Stationery,23.16,4.2
513,Thermal Base Layer Top Deluxe,"Moisture-wicking base layer for skiing, snowboarding, and winter sports. Highly rated by customers.",Clothing,33.74,4.5
514,Family Board Game Strategy Essential,"Award-winning tabletop game for 2-4 players, 45-minute play time.",Toys & Games,55.23,4.6
515,Vitamin C Face Serum Deluxe - Red,Brightening antioxidant serum to reduce dark spots and improve skin radiance.,Beauty & Personal Care,9.6,3.6
516,Yoga Block and Strap Set Lite,Cork blocks and cotton strap to improve flexibility and alignment in poses.,Health & Wellness,48.99,3.9
517,Productivity Planner 2026 Essential,"Undated daily planner with goal tracking, habit pages, and monthly reviews.",Books & Stationery,39.56,3.7
